{
  "canonicalCopiesIdentical": true,
  "kind": "obds-release-audit",
  "legacyColourHexPublic": false,
  "nodeRequiredForInteropTests": true,
  "packageFileCount": 300,
  "packageJunkFiles": 0,
  "publicSchemaCount": 21,
  "publicValueSchemaCount": 6,
  "release": "4.1.0",
  "schemaSurfaceFingerprint": "sha256:517683bb3496867daa2346ceb2f7844e46015f926ff757a9c23da90cf1e5f469",
  "schemaSurfaceUnchangedSince": "1.0.0",
  "schemaVersion": "1.0.0",
  "stablePromotionRetested": true,
  "status": "stable",
  "suiteCounts": {
    "adversarial": 38,
    "context-assembly": 24,
    "context-delivery": 3,
    "design-space": 20,
    "foundation": 1052,
    "golden": 6,
    "integration": 15
  },
  "testOutputHash": "sha256:9fdbcba2bf8ba151d4510a9fd7695cbd551bcd1eebe5fd1d40057692c53fdc62",
  "testsFailed": 0,
  "testsPassed": 1158,
  "testsSkipped": 0,
  "unsupportedTokenizerFailsClosed": true
}
