{
  "canonicalCopiesIdentical": true,
  "kind": "obds-release-audit",
  "legacyColourHexPublic": false,
  "modelInputExampleBytesAfter": 1272,
  "modelInputExampleBytesBefore": 2338,
  "modelInputExampleReductionPercent": 45.6,
  "nodeRequiredForInteropTests": true,
  "packageFileCount": 172,
  "packageJunkFiles": 0,
  "publicSchemaCount": 21,
  "publicValueSchemaCount": 6,
  "release": "1.0.3",
  "schemaSurfaceFingerprint": "sha256:517683bb3496867daa2346ceb2f7844e46015f926ff757a9c23da90cf1e5f469",
  "schemaSurfaceUnchangedSince": "1.0.0",
  "schemaVersion": "1.0.0",
  "stablePromotionRetested": true,
  "status": "stable",
  "suiteCounts": {
    "adversarial": 23,
    "context-assembly": 15,
    "context-delivery": 3,
    "design-space": 18,
    "foundation": 27,
    "golden": 6,
    "integration": 15
  },
  "testOutputHash": "sha256:95e2296a06fa5bea78dfaf38e46df873d156e487e1e16096d2f9619781731392",
  "testsFailed": 0,
  "testsPassed": 107,
  "testsSkipped": 0,
  "unsupportedTokenizerFailsClosed": true
}
